{
    "lastname": "Potiron",
    "firstname": "Quentin",
    "socials": [
        {
            "type": "linkedin",
            "url": "https://www.linkedin.com/in/quentin-potiron-424146309/"
        },
        {
            "type": "github",
            "url": "https://github.com/Azarta2Zygoto"
        }
    ],
    "gmail": "quentin.potiron@gmail.com",
    "job": "Centrale Lyon",
    "languages": ["fr", "en", "es"],
    "nationality": ["fr"]
}
